{
  "description": "ResourceQuotaSpec defines the desired hard limits to enforce for Quota.",
  "type": "object",
  "properties": {
    "hard": {
      "description": "hard is the set of desired hard limits for each named resource. More info: https://kubernetes.io/docs/concepts/policy/resource-quotas/",
      "type": "object",
      "additionalProperties": {
        "description": "Quantity is a fixed-point representation of a number. It provides convenient marshaling/unmarshaling in JSON and YAML, in addition to String() and AsInt64() accessors.\n\nThe serialization format is:\n\n``` <quantity>        ::= <signedNumber><suffix>\n\n\t(Note that <suffix> may be empty, from the \"\" case in <decimalSI>.)\n\n<digit>           ::= 0 | 1 | ... | 9 <digits>          ::= <digit> | <digit><digits> <number>          ::= <digits> | <digits>.<digits> | <digits>. | .<digits> <sign>            ::= \"+\" | \"-\" <signedNumber>    ::= <number> | <sign><number> <suffix>          ::= <binarySI> | <decimalExponent> | <decimalSI> <binarySI>        ::= Ki | Mi | Gi | Ti | Pi | Ei\n\n\t(International System of units; See: http://physics.nist.gov/cuu/Units/binary.html)\n\n<decimalSI>       ::= m | \"\" | k | M | G | T | P | E\n\n\t(Note that 1024 = 1Ki but 1000 = 1k; I didn't choose the capitalization.)\n\n<decimalExponent> ::= \"e\" <signedNumber> | \"E\" <signedNumber> ```\n\nNo matter which of the three exponent forms is used, no quantity may represent a number greater than 2^63-1 in magnitude, nor may it have more than 3 decimal places. Numbers larger or more precise will be capped or rounded up. (E.g.: 0.1m will rounded up to 1m.) This may be extended in the future if we require larger or smaller quantities.\n\nWhen a Quantity is parsed from a string, it will remember the type of suffix it had, and will use the same type again when it is serialized.\n\nBefore serializing, Quantity will be put in \"canonical form\". This means that Exponent/suffix will be adjusted up or down (with a corresponding increase or decrease in Mantissa) such that:\n\n- No precision is lost - No fractional digits will be emitted - The exponent (or suffix) is as large as possible.\n\nThe sign will be omitted unless the number is negative.\n\nExamples:\n\n- 1.5 will be serialized as \"1500m\" - 1.5Gi will be serialized as \"1536Mi\"\n\nNote that the quantity will NEVER be internally represented by a floating point number. That is the whole point of this exercise.\n\nNon-canonical values will still parse as long as they are well formed, but will be re-emitted in their canonical form. (So always use canonical form, or don't diff.)\n\nThis format is intended to make it difficult to use these numbers without writing some sort of special handling code in the hopes that that will cause implementors to also use a fixed point implementation.",
        "type": "string",
        "properties": {},
        "additionalProperties": false
      }
    },
    "scopeSelector": {
      "description": "A scope selector represents the AND of the selectors represented by the scoped-resource selector requirements.",
      "type": "object",
      "properties": {
        "matchExpressions": {
          "description": "A list of scope selector requirements by scope of the resources.",
          "type": "array",
          "items": {
            "description": "A scoped-resource selector requirement is a selector that contains values, a scope name, and an operator that relates the scope name and values.",
            "type": "object",
            "required": [
              "scopeName",
              "operator"
            ],
            "properties": {
              "operator": {
                "description": "Represents a scope's relationship to a set of values. Valid operators are In, NotIn, Exists, DoesNotExist.\n\nPossible enum values:\n - `\"DoesNotExist\"`\n - `\"Exists\"`\n - `\"In\"`\n - `\"NotIn\"`",
                "type": "string",
                "enum": [
                  "DoesNotExist",
                  "Exists",
                  "In",
                  "NotIn"
                ]
              },
              "scopeName": {
                "description": "The name of the scope that the selector applies to.\n\nPossible enum values:\n - `\"BestEffort\"` Match all pod objects that have best effort quality of service\n - `\"CrossNamespacePodAffinity\"` Match all pod objects that have cross-namespace pod (anti)affinity mentioned.\n - `\"NotBestEffort\"` Match all pod objects that do not have best effort quality of service\n - `\"NotTerminating\"` Match all pod objects where spec.activeDeadlineSeconds is nil\n - `\"PriorityClass\"` Match all pod objects that have priority class mentioned\n - `\"Terminating\"` Match all pod objects where spec.activeDeadlineSeconds >=0\n - `\"VolumeAttributesClass\"` Match all pvc objects that have volume attributes class mentioned.",
                "type": "string",
                "enum": [
                  "BestEffort",
                  "CrossNamespacePodAffinity",
                  "NotBestEffort",
                  "NotTerminating",
                  "PriorityClass",
                  "Terminating",
                  "VolumeAttributesClass"
                ]
              },
              "values": {
                "description": "An array of string values. If the operator is In or NotIn, the values array must be non-empty. If the operator is Exists or DoesNotExist, the values array must be empty. This array is replaced during a strategic merge patch.",
                "type": "array",
                "items": {
                  "type": "string"
                },
                "x-kubernetes-list-type": "atomic"
              }
            },
            "additionalProperties": false
          },
          "x-kubernetes-list-type": "atomic"
        }
      },
      "x-kubernetes-map-type": "atomic",
      "additionalProperties": false
    },
    "scopes": {
      "description": "A collection of filters that must match each object tracked by a quota. If not specified, the quota matches all objects.",
      "type": "array",
      "items": {
        "type": "string",
        "enum": [
          "BestEffort",
          "CrossNamespacePodAffinity",
          "NotBestEffort",
          "NotTerminating",
          "PriorityClass",
          "Terminating",
          "VolumeAttributesClass"
        ]
      },
      "x-kubernetes-list-type": "atomic"
    }
  },
  "additionalProperties": false,
  "$schema": "http://json-schema.org/schema#"
}