{
  "type": "object",
  "required": [
    "name"
  ],
  "properties": {
    "blockSize": {
      "description": "BlockSize provides the option to change the block size presented to the VM for a disk. Only one of its members may be specified.",
      "type": "object",
      "properties": {
        "custom": {
          "description": "CustomBlockSize represents the desired logical and physical block size for a VM disk.",
          "type": "object",
          "properties": {
            "discardGranularity": {
              "type": "integer",
              "format": "int32"
            },
            "logical": {
              "type": "integer",
              "format": "int32"
            },
            "physical": {
              "type": "integer",
              "format": "int32"
            }
          },
          "additionalProperties": false
        },
        "matchVolume": {
          "description": "Represents if a feature is enabled or disabled.",
          "type": "object",
          "properties": {
            "enabled": {
              "description": "Enabled determines if the feature should be enabled or disabled on the guest. Defaults to true.",
              "type": "boolean"
            }
          },
          "additionalProperties": false
        }
      },
      "additionalProperties": false
    },
    "bootOrder": {
      "description": "BootOrder is an integer value > 0, used to determine ordering of boot devices. Lower values take precedence. Each disk or interface that has a boot order must have a unique value. Disks without a boot order are not tried if a disk with a boot order exists.",
      "type": "integer",
      "format": "int32"
    },
    "cache": {
      "description": "Cache specifies which kvm disk cache mode should be used. Supported values are: none: Guest I/O not cached on the host, but may be kept in a disk cache. writethrough: Guest I/O cached on the host but written through to the physical medium. Slowest but with most guarantees. writeback: Guest I/O cached on the host. Defaults to none if the storage supports O_DIRECT, otherwise writethrough.",
      "type": "string"
    },
    "cdrom": {
      "type": "object",
      "properties": {
        "bus": {
          "description": "Bus indicates the type of disk device to emulate. supported values: virtio, sata, scsi.",
          "type": "string"
        },
        "readonly": {
          "description": "ReadOnly. Defaults to true.",
          "type": "boolean"
        },
        "tray": {
          "description": "Tray indicates if the tray of the device is open or closed. Allowed values are \"open\" and \"closed\". Defaults to closed.",
          "type": "string"
        }
      },
      "additionalProperties": false
    },
    "changedBlockTracking": {
      "description": "ChangedBlockTracking indicates this disk should have CBT option Defaults to false.",
      "type": "boolean"
    },
    "dedicatedIOThread": {
      "description": "dedicatedIOThread indicates this disk should have an exclusive IO Thread. Enabling this implies useIOThreads = true. Defaults to false.",
      "type": "boolean"
    },
    "disk": {
      "type": "object",
      "properties": {
        "bus": {
          "description": "Bus indicates the type of disk device to emulate. supported values: virtio, sata, scsi, usb.",
          "type": "string"
        },
        "pciAddress": {
          "description": "If specified, the virtual disk will be placed on the guests pci address with the specified PCI address. For example: 0000:81:01.10",
          "type": "string"
        },
        "readonly": {
          "description": "ReadOnly. Defaults to false.",
          "type": "boolean"
        }
      },
      "additionalProperties": false
    },
    "errorPolicy": {
      "description": "If specified, it can change the default error policy (stop) for the disk",
      "type": "string"
    },
    "io": {
      "description": "IO specifies which QEMU disk IO mode should be used. Supported values are: native, default, threads.",
      "type": "string"
    },
    "lun": {
      "type": "object",
      "properties": {
        "bus": {
          "description": "Bus indicates the type of disk device to emulate. supported values: virtio, sata, scsi.",
          "type": "string"
        },
        "readonly": {
          "description": "ReadOnly. Defaults to false.",
          "type": "boolean"
        },
        "reservation": {
          "description": "Reservation indicates if the disk needs to support the persistent reservation for the SCSI disk",
          "type": "boolean"
        }
      },
      "additionalProperties": false
    },
    "name": {
      "description": "Name is the device name",
      "type": "string",
      "default": ""
    },
    "serial": {
      "description": "Serial provides the ability to specify a serial number for the disk device.",
      "type": "string"
    },
    "shareable": {
      "description": "If specified the disk is made sharable and multiple write from different VMs are permitted",
      "type": "boolean"
    },
    "tag": {
      "description": "If specified, disk address and its tag will be provided to the guest via config drive metadata",
      "type": "string"
    }
  },
  "additionalProperties": false,
  "$schema": "http://json-schema.org/schema#"
}