{
  "description": "JenkinsPipelineBuildStrategy holds parameters specific to a Jenkins Pipeline build. Deprecated: use OpenShift Pipelines",
  "type": "object",
  "properties": {
    "env": {
      "description": "env contains additional environment variables you want to pass into a build pipeline.",
      "type": "array",
      "items": {
        "description": "EnvVar represents an environment variable present in a Container.",
        "type": "object",
        "required": [
          "name"
        ],
        "properties": {
          "name": {
            "description": "Name of the environment variable. Must be a C_IDENTIFIER.",
            "type": "string"
          },
          "value": {
            "description": "Variable references $(VAR_NAME) are expanded using the previously defined environment variables in the container and any service environment variables. If a variable cannot be resolved, the reference in the input string will be unchanged. Double $$ are reduced to a single $, which allows for escaping the $(VAR_NAME) syntax: i.e. \"$$(VAR_NAME)\" will produce the string literal \"$(VAR_NAME)\". Escaped references will never be expanded, regardless of whether the variable exists or not. Defaults to \"\".",
            "type": "string"
          },
          "valueFrom": {
            "description": "EnvVarSource represents a source for the value of an EnvVar.",
            "type": "object",
            "properties": {
              "configMapKeyRef": {
                "description": "Selects a key from a ConfigMap.",
                "type": "object",
                "required": [
                  "key"
                ],
                "properties": {
                  "key": {
                    "description": "The key to select.",
                    "type": "string"
                  },
                  "name": {
                    "description": "Name of the referent. More info: https://kubernetes.io/docs/concepts/overview/working-with-objects/names/#names",
                    "type": "string"
                  },
                  "optional": {
                    "description": "Specify whether the ConfigMap or its key must be defined",
                    "type": "boolean"
                  }
                },
                "x-kubernetes-map-type": "atomic",
                "additionalProperties": false
              },
              "fieldRef": {
                "description": "ObjectFieldSelector selects an APIVersioned field of an object.",
                "type": "object",
                "required": [
                  "fieldPath"
                ],
                "properties": {
                  "apiVersion": {
                    "description": "Version of the schema the FieldPath is written in terms of, defaults to \"v1\".",
                    "type": "string"
                  },
                  "fieldPath": {
                    "description": "Path of the field to select in the specified API version.",
                    "type": "string"
                  }
                },
                "x-kubernetes-map-type": "atomic",
                "additionalProperties": false
              },
              "resourceFieldRef": {
                "description": "ResourceFieldSelector represents container resources (cpu, memory) and their output format",
                "type": "object",
                "required": [
                  "resource"
                ],
                "properties": {
                  "containerName": {
                    "description": "Container name: required for volumes, optional for env vars",
                    "type": "string"
                  },
                  "divisor": {
                    "description": "Quantity is a fixed-point representation of a number. It provides convenient marshaling/unmarshaling in JSON and YAML, in addition to String() and AsInt64() accessors.\n\nThe serialization format is:\n\n``` <quantity>        ::= <signedNumber><suffix>\n\n\t(Note that <suffix> may be empty, from the \"\" case in <decimalSI>.)\n\n<digit>           ::= 0 | 1 | ... | 9 <digits>          ::= <digit> | <digit><digits> <number>          ::= <digits> | <digits>.<digits> | <digits>. | .<digits> <sign>            ::= \"+\" | \"-\" <signedNumber>    ::= <number> | <sign><number> <suffix>          ::= <binarySI> | <decimalExponent> | <decimalSI> <binarySI>        ::= Ki | Mi | Gi | Ti | Pi | Ei\n\n\t(International System of units; See: http://physics.nist.gov/cuu/Units/binary.html)\n\n<decimalSI>       ::= m | \"\" | k | M | G | T | P | E\n\n\t(Note that 1024 = 1Ki but 1000 = 1k; I didn't choose the capitalization.)\n\n<decimalExponent> ::= \"e\" <signedNumber> | \"E\" <signedNumber> ```\n\nNo matter which of the three exponent forms is used, no quantity may represent a number greater than 2^63-1 in magnitude, nor may it have more than 3 decimal places. Numbers larger or more precise will be capped or rounded up. (E.g.: 0.1m will rounded up to 1m.) This may be extended in the future if we require larger or smaller quantities.\n\nWhen a Quantity is parsed from a string, it will remember the type of suffix it had, and will use the same type again when it is serialized.\n\nBefore serializing, Quantity will be put in \"canonical form\". This means that Exponent/suffix will be adjusted up or down (with a corresponding increase or decrease in Mantissa) such that:\n\n- No precision is lost - No fractional digits will be emitted - The exponent (or suffix) is as large as possible.\n\nThe sign will be omitted unless the number is negative.\n\nExamples:\n\n- 1.5 will be serialized as \"1500m\" - 1.5Gi will be serialized as \"1536Mi\"\n\nNote that the quantity will NEVER be internally represented by a floating point number. That is the whole point of this exercise.\n\nNon-canonical values will still parse as long as they are well formed, but will be re-emitted in their canonical form. (So always use canonical form, or don't diff.)\n\nThis format is intended to make it difficult to use these numbers without writing some sort of special handling code in the hopes that that will cause implementors to also use a fixed point implementation.",
                    "type": "string",
                    "properties": {},
                    "additionalProperties": false
                  },
                  "resource": {
                    "description": "Required: resource to select",
                    "type": "string"
                  }
                },
                "x-kubernetes-map-type": "atomic",
                "additionalProperties": false
              },
              "secretKeyRef": {
                "description": "SecretKeySelector selects a key of a Secret.",
                "type": "object",
                "required": [
                  "key"
                ],
                "properties": {
                  "key": {
                    "description": "The key of the secret to select from.  Must be a valid secret key.",
                    "type": "string"
                  },
                  "name": {
                    "description": "Name of the referent. More info: https://kubernetes.io/docs/concepts/overview/working-with-objects/names/#names",
                    "type": "string"
                  },
                  "optional": {
                    "description": "Specify whether the Secret or its key must be defined",
                    "type": "boolean"
                  }
                },
                "x-kubernetes-map-type": "atomic",
                "additionalProperties": false
              }
            },
            "additionalProperties": false
          }
        },
        "additionalProperties": false
      }
    },
    "jenkinsfile": {
      "description": "Jenkinsfile defines the optional raw contents of a Jenkinsfile which defines a Jenkins pipeline build.",
      "type": "string"
    },
    "jenkinsfilePath": {
      "description": "JenkinsfilePath is the optional path of the Jenkinsfile that will be used to configure the pipeline relative to the root of the context (contextDir). If both JenkinsfilePath & Jenkinsfile are both not specified, this defaults to Jenkinsfile in the root of the specified contextDir.",
      "type": "string"
    }
  },
  "additionalProperties": false,
  "$schema": "http://json-schema.org/schema#"
}