{
  "description": "StatefulSetStatus represents the current state of a StatefulSet.",
  "type": "object",
  "required": [
    "replicas"
  ],
  "properties": {
    "availableReplicas": {
      "description": "Total number of available pods (ready for at least minReadySeconds) targeted by this statefulset.",
      "type": "integer",
      "format": "int32"
    },
    "collisionCount": {
      "description": "collisionCount is the count of hash collisions for the StatefulSet. The StatefulSet controller uses this field as a collision avoidance mechanism when it needs to create the name for the newest ControllerRevision.",
      "type": "integer",
      "format": "int32"
    },
    "conditions": {
      "description": "Represents the latest available observations of a statefulset's current state.",
      "type": "array",
      "items": {
        "description": "StatefulSetCondition describes the state of a statefulset at a certain point.",
        "type": "object",
        "required": [
          "type",
          "status"
        ],
        "properties": {
          "lastTransitionTime": {
            "description": "Time is a wrapper around time.Time which supports correct marshaling to YAML and JSON.  Wrappers are provided for many of the factory methods that the time package offers.",
            "type": "string",
            "format": "date-time",
            "properties": {},
            "additionalProperties": false
          },
          "message": {
            "description": "A human readable message indicating details about the transition.",
            "type": "string"
          },
          "reason": {
            "description": "The reason for the condition's last transition.",
            "type": "string"
          },
          "status": {
            "description": "Status of the condition, one of True, False, Unknown.",
            "type": "string"
          },
          "type": {
            "description": "Type of statefulset condition.",
            "type": "string"
          }
        },
        "additionalProperties": false
      },
      "x-kubernetes-list-map-keys": [
        "type"
      ],
      "x-kubernetes-list-type": "map",
      "x-kubernetes-patch-merge-key": "type",
      "x-kubernetes-patch-strategy": "merge"
    },
    "currentReplicas": {
      "description": "currentReplicas is the number of Pods created by the StatefulSet controller from the StatefulSet version indicated by currentRevision.",
      "type": "integer",
      "format": "int32"
    },
    "currentRevision": {
      "description": "currentRevision, if not empty, indicates the version of the StatefulSet used to generate Pods in the sequence [0,currentReplicas).",
      "type": "string"
    },
    "observedGeneration": {
      "description": "observedGeneration is the most recent generation observed for this StatefulSet. It corresponds to the StatefulSet's generation, which is updated on mutation by the API Server.",
      "type": "integer",
      "format": "int64"
    },
    "readyReplicas": {
      "description": "readyReplicas is the number of pods created for this StatefulSet with a Ready Condition.",
      "type": "integer",
      "format": "int32"
    },
    "replicas": {
      "description": "replicas is the number of Pods created by the StatefulSet controller.",
      "type": "integer",
      "format": "int32"
    },
    "updateRevision": {
      "description": "updateRevision, if not empty, indicates the version of the StatefulSet used to generate Pods in the sequence [replicas-updatedReplicas,replicas)",
      "type": "string"
    },
    "updatedReplicas": {
      "description": "updatedReplicas is the number of Pods created by the StatefulSet controller from the StatefulSet version indicated by updateRevision.",
      "type": "integer",
      "format": "int32"
    }
  },
  "additionalProperties": false,
  "$schema": "http://json-schema.org/schema#"
}