{
  "description": "Represents downward API info for projecting into a projected volume. Note that this is identical to a downwardAPI volume source without the default mode.",
  "type": "object",
  "properties": {
    "items": {
      "description": "Items is a list of DownwardAPIVolume file",
      "type": "array",
      "items": {
        "description": "DownwardAPIVolumeFile represents information to create the file containing the pod field",
        "type": "object",
        "required": [
          "path"
        ],
        "properties": {
          "fieldRef": {
            "description": "ObjectFieldSelector selects an APIVersioned field of an object.",
            "type": "object",
            "required": [
              "fieldPath"
            ],
            "properties": {
              "apiVersion": {
                "description": "Version of the schema the FieldPath is written in terms of, defaults to \"v1\".",
                "type": "string"
              },
              "fieldPath": {
                "description": "Path of the field to select in the specified API version.",
                "type": "string"
              }
            },
            "x-kubernetes-map-type": "atomic",
            "additionalProperties": false
          },
          "mode": {
            "description": "Optional: mode bits used to set permissions on this file, must be an octal value between 0000 and 0777 or a decimal value between 0 and 511. YAML accepts both octal and decimal values, JSON requires decimal values for mode bits. If not specified, the volume defaultMode will be used. This might be in conflict with other options that affect the file mode, like fsGroup, and the result can be other mode bits set.",
            "type": "integer",
            "format": "int32"
          },
          "path": {
            "description": "Required: Path is  the relative path name of the file to be created. Must not be absolute or contain the '..' path. Must be utf-8 encoded. The first item of the relative path must not start with '..'",
            "type": "string"
          },
          "resourceFieldRef": {
            "description": "ResourceFieldSelector represents container resources (cpu, memory) and their output format",
            "type": "object",
            "required": [
              "resource"
            ],
            "properties": {
              "containerName": {
                "description": "Container name: required for volumes, optional for env vars",
                "type": "string"
              },
              "divisor": {
                "description": "Quantity is a fixed-point representation of a number. It provides convenient marshaling/unmarshaling in JSON and YAML, in addition to String() and AsInt64() accessors.\n\nThe serialization format is:\n\n``` <quantity>        ::= <signedNumber><suffix>\n\n\t(Note that <suffix> may be empty, from the \"\" case in <decimalSI>.)\n\n<digit>           ::= 0 | 1 | ... | 9 <digits>          ::= <digit> | <digit><digits> <number>          ::= <digits> | <digits>.<digits> | <digits>. | .<digits> <sign>            ::= \"+\" | \"-\" <signedNumber>    ::= <number> | <sign><number> <suffix>          ::= <binarySI> | <decimalExponent> | <decimalSI> <binarySI>        ::= Ki | Mi | Gi | Ti | Pi | Ei\n\n\t(International System of units; See: http://physics.nist.gov/cuu/Units/binary.html)\n\n<decimalSI>       ::= m | \"\" | k | M | G | T | P | E\n\n\t(Note that 1024 = 1Ki but 1000 = 1k; I didn't choose the capitalization.)\n\n<decimalExponent> ::= \"e\" <signedNumber> | \"E\" <signedNumber> ```\n\nNo matter which of the three exponent forms is used, no quantity may represent a number greater than 2^63-1 in magnitude, nor may it have more than 3 decimal places. Numbers larger or more precise will be capped or rounded up. (E.g.: 0.1m will rounded up to 1m.) This may be extended in the future if we require larger or smaller quantities.\n\nWhen a Quantity is parsed from a string, it will remember the type of suffix it had, and will use the same type again when it is serialized.\n\nBefore serializing, Quantity will be put in \"canonical form\". This means that Exponent/suffix will be adjusted up or down (with a corresponding increase or decrease in Mantissa) such that:\n\n- No precision is lost - No fractional digits will be emitted - The exponent (or suffix) is as large as possible.\n\nThe sign will be omitted unless the number is negative.\n\nExamples:\n\n- 1.5 will be serialized as \"1500m\" - 1.5Gi will be serialized as \"1536Mi\"\n\nNote that the quantity will NEVER be internally represented by a floating point number. That is the whole point of this exercise.\n\nNon-canonical values will still parse as long as they are well formed, but will be re-emitted in their canonical form. (So always use canonical form, or don't diff.)\n\nThis format is intended to make it difficult to use these numbers without writing some sort of special handling code in the hopes that that will cause implementors to also use a fixed point implementation.",
                "type": "string",
                "properties": {},
                "additionalProperties": false
              },
              "resource": {
                "description": "Required: resource to select",
                "type": "string"
              }
            },
            "x-kubernetes-map-type": "atomic",
            "additionalProperties": false
          }
        },
        "additionalProperties": false
      },
      "x-kubernetes-list-type": "atomic"
    }
  },
  "additionalProperties": false,
  "$schema": "http://json-schema.org/schema#"
}