{
  "description": "ContainerResourceMetricSource indicates how to scale on a resource metric known to Kubernetes, as specified in requests and limits, describing each pod in the current scale target (e.g. CPU or memory).  The values will be averaged together before being compared to the target.  Such metrics are built in to Kubernetes, and have special scaling options on top of those available to normal per-pod metrics using the \"pods\" source.  Only one \"target\" type should be set.",
  "type": "object",
  "required": [
    "name",
    "target",
    "container"
  ],
  "properties": {
    "container": {
      "description": "container is the name of the container in the pods of the scaling target",
      "type": "string"
    },
    "name": {
      "description": "name is the name of the resource in question.",
      "type": "string"
    },
    "target": {
      "description": "MetricTarget defines the target value, average value, or average utilization of a specific metric",
      "type": "object",
      "required": [
        "type"
      ],
      "properties": {
        "averageUtilization": {
          "description": "averageUtilization is the target value of the average of the resource metric across all relevant pods, represented as a percentage of the requested value of the resource for the pods. Currently only valid for Resource metric source type",
          "type": "integer",
          "format": "int32"
        },
        "averageValue": {
          "description": "Quantity is a fixed-point representation of a number. It provides convenient marshaling/unmarshaling in JSON and YAML, in addition to String() and AsInt64() accessors.\n\nThe serialization format is:\n\n``` <quantity>        ::= <signedNumber><suffix>\n\n\t(Note that <suffix> may be empty, from the \"\" case in <decimalSI>.)\n\n<digit>           ::= 0 | 1 | ... | 9 <digits>          ::= <digit> | <digit><digits> <number>          ::= <digits> | <digits>.<digits> | <digits>. | .<digits> <sign>            ::= \"+\" | \"-\" <signedNumber>    ::= <number> | <sign><number> <suffix>          ::= <binarySI> | <decimalExponent> | <decimalSI> <binarySI>        ::= Ki | Mi | Gi | Ti | Pi | Ei\n\n\t(International System of units; See: http://physics.nist.gov/cuu/Units/binary.html)\n\n<decimalSI>       ::= m | \"\" | k | M | G | T | P | E\n\n\t(Note that 1024 = 1Ki but 1000 = 1k; I didn't choose the capitalization.)\n\n<decimalExponent> ::= \"e\" <signedNumber> | \"E\" <signedNumber> ```\n\nNo matter which of the three exponent forms is used, no quantity may represent a number greater than 2^63-1 in magnitude, nor may it have more than 3 decimal places. Numbers larger or more precise will be capped or rounded up. (E.g.: 0.1m will rounded up to 1m.) This may be extended in the future if we require larger or smaller quantities.\n\nWhen a Quantity is parsed from a string, it will remember the type of suffix it had, and will use the same type again when it is serialized.\n\nBefore serializing, Quantity will be put in \"canonical form\". This means that Exponent/suffix will be adjusted up or down (with a corresponding increase or decrease in Mantissa) such that:\n\n- No precision is lost - No fractional digits will be emitted - The exponent (or suffix) is as large as possible.\n\nThe sign will be omitted unless the number is negative.\n\nExamples:\n\n- 1.5 will be serialized as \"1500m\" - 1.5Gi will be serialized as \"1536Mi\"\n\nNote that the quantity will NEVER be internally represented by a floating point number. That is the whole point of this exercise.\n\nNon-canonical values will still parse as long as they are well formed, but will be re-emitted in their canonical form. (So always use canonical form, or don't diff.)\n\nThis format is intended to make it difficult to use these numbers without writing some sort of special handling code in the hopes that that will cause implementors to also use a fixed point implementation.",
          "type": "string"
        },
        "type": {
          "description": "type represents whether the metric type is Utilization, Value, or AverageValue",
          "type": "string"
        },
        "value": {
          "description": "Quantity is a fixed-point representation of a number. It provides convenient marshaling/unmarshaling in JSON and YAML, in addition to String() and AsInt64() accessors.\n\nThe serialization format is:\n\n``` <quantity>        ::= <signedNumber><suffix>\n\n\t(Note that <suffix> may be empty, from the \"\" case in <decimalSI>.)\n\n<digit>           ::= 0 | 1 | ... | 9 <digits>          ::= <digit> | <digit><digits> <number>          ::= <digits> | <digits>.<digits> | <digits>. | .<digits> <sign>            ::= \"+\" | \"-\" <signedNumber>    ::= <number> | <sign><number> <suffix>          ::= <binarySI> | <decimalExponent> | <decimalSI> <binarySI>        ::= Ki | Mi | Gi | Ti | Pi | Ei\n\n\t(International System of units; See: http://physics.nist.gov/cuu/Units/binary.html)\n\n<decimalSI>       ::= m | \"\" | k | M | G | T | P | E\n\n\t(Note that 1024 = 1Ki but 1000 = 1k; I didn't choose the capitalization.)\n\n<decimalExponent> ::= \"e\" <signedNumber> | \"E\" <signedNumber> ```\n\nNo matter which of the three exponent forms is used, no quantity may represent a number greater than 2^63-1 in magnitude, nor may it have more than 3 decimal places. Numbers larger or more precise will be capped or rounded up. (E.g.: 0.1m will rounded up to 1m.) This may be extended in the future if we require larger or smaller quantities.\n\nWhen a Quantity is parsed from a string, it will remember the type of suffix it had, and will use the same type again when it is serialized.\n\nBefore serializing, Quantity will be put in \"canonical form\". This means that Exponent/suffix will be adjusted up or down (with a corresponding increase or decrease in Mantissa) such that:\n\n- No precision is lost - No fractional digits will be emitted - The exponent (or suffix) is as large as possible.\n\nThe sign will be omitted unless the number is negative.\n\nExamples:\n\n- 1.5 will be serialized as \"1500m\" - 1.5Gi will be serialized as \"1536Mi\"\n\nNote that the quantity will NEVER be internally represented by a floating point number. That is the whole point of this exercise.\n\nNon-canonical values will still parse as long as they are well formed, but will be re-emitted in their canonical form. (So always use canonical form, or don't diff.)\n\nThis format is intended to make it difficult to use these numbers without writing some sort of special handling code in the hopes that that will cause implementors to also use a fixed point implementation.",
          "type": "string"
        }
      }
    },
    "apiVersion": {
      "type": "string"
    },
    "kind": {
      "type": "string"
    },
    "metadata": {
      "type": "object"
    }
  },
  "$schema": "http://json-schema.org/schema#"
}