{
  "description": "IngressStatus describe the current state of the Ingress.",
  "type": "object",
  "properties": {
    "loadBalancer": {
      "description": "IngressLoadBalancerStatus represents the status of a load-balancer.",
      "type": "object",
      "properties": {
        "ingress": {
          "description": "ingress is a list containing ingress points for the load-balancer.",
          "type": "array",
          "items": {
            "description": "IngressLoadBalancerIngress represents the status of a load-balancer ingress point.",
            "type": "object",
            "properties": {
              "hostname": {
                "description": "hostname is set for load-balancer ingress points that are DNS based.",
                "type": "string"
              },
              "ip": {
                "description": "ip is set for load-balancer ingress points that are IP based.",
                "type": "string"
              },
              "ports": {
                "description": "ports provides information about the ports exposed by this LoadBalancer.",
                "type": "array",
                "items": {
                  "description": "IngressPortStatus represents the error condition of a service port",
                  "type": "object",
                  "required": [
                    "port",
                    "protocol"
                  ],
                  "properties": {
                    "error": {
                      "description": "error is to record the problem with the service port The format of the error shall comply with the following rules: - built-in error values shall be specified in this file and those shall use\n  CamelCase names\n- cloud provider specific error values must have names that comply with the\n  format foo.example.com/CamelCase.",
                      "type": "string"
                    },
                    "port": {
                      "description": "port is the port number of the ingress port.",
                      "type": "integer",
                      "format": "int32"
                    },
                    "protocol": {
                      "description": "protocol is the protocol of the ingress port. The supported values are: \"TCP\", \"UDP\", \"SCTP\"\n\nPossible enum values:\n - `\"SCTP\"` is the SCTP protocol.\n - `\"TCP\"` is the TCP protocol.\n - `\"UDP\"` is the UDP protocol.",
                      "type": "string",
                      "enum": [
                        "SCTP",
                        "TCP",
                        "UDP"
                      ]
                    }
                  },
                  "additionalProperties": false
                },
                "x-kubernetes-list-type": "atomic"
              }
            },
            "additionalProperties": false
          },
          "x-kubernetes-list-type": "atomic"
        }
      },
      "additionalProperties": false
    }
  },
  "additionalProperties": false,
  "$schema": "http://json-schema.org/schema#"
}